"Question","Topic","Subject"
"When a liquid changes into a solid what is it called","Chemistry","Science"
"Molecules in this phase of matter are tightly packed together","Chemistry","Science"
"What does photosynthesis produce","Chemistry","Science"
"What is it called when matter changes from one state of matter to another","Chemistry","Science"
"What is it called when a solid changes into a liquid","Chemistry","Science"
"What are the three major states of matter","Chemistry","Science"
"Which of the following is NOT a phase of matter","Chemistry","Science"
"Which states of matter do NOT have a definite shape","Chemistry","Science"
"In what process do cells obtain energy from sugar molecules","Chemistry","Science"
"Which lists the substances from least to most acidic","Chemistry","Science"
"What is an example of a solid turning into another state of matter","Chemistry","Science"
"Which of the following descriptions depicts a liquid","Chemistry","Science"
"Atoms consist of which of the following","Chemistry","Science"
"Which best describes oxygen","Chemistry","Science"
"How many neutrons in an atom of chlorine","Chemistry","Science"
"What has a definite shape and volume","Chemistry","Science"
"You can determine the concentration of acids or bases in a solution by using","Chemistry","Science"
"Positively-charged particles are called ","Chemistry","Science"
"The atomic number of an atom is determined by the number of","Chemistry","Science"
"Particles of matter that move faster (like in a gas) have more of what","Chemistry","Science"
"Which of the following is a characteristic of liquids","Chemistry","Science"
"Which state of matter is easily compressed and easily changes shape to fill its container","Chemistry","Science"
"What is a pure substance that cannot be broken down into other substances by chemical or physical means","Chemistry","Science"
"What causes changes in the state of matter","Chemistry","Science"
"A solution at pH is ","Chemistry","Science"
"What are the two major categories of matter","Chemistry","Science"
"What is the amount of space and object takes up called","Chemistry","Science"
"How many neutrons in an atom of chlorine","Chemistry","Science"
"What is the atomic number of hydrogen","Chemistry","Science"
"Which of the following is an indicator of a chemical change or reaction","Chemistry","Science"
"The negatively charged particles in an atom that orbit around the nucleus are called","Chemistry","Science"
"The first Periodic Table was organized by ","Chemistry","Science"
"Which element has 4 neutrons","Chemistry","Science"
"Copper is located in Group 4 and Period 11 of the periodic table","Chemistry","Science"
"Substances that are formed during a chemical change are known as which of the following","Chemistry","Science"
"Mercury is a metalloid","Chemistry","Science"
"Cobalt has 27 protons","Chemistry","Science"
"How is a mixture different from a compound","Chemistry","Science"
"What is a chemical bond","Chemistry","Science"
"Which type of chemicals help to digest food","Chemistry","Science"
"The number of protons in an atom is equal to the","Chemistry","Science"
"The atomic mass is always larger than the atomic number","Chemistry","Science"
"Which substance dissolves another","Chemistry","Science"
"The atomic number and the atomic mass are the same number","Chemistry","Science"
"What is the chemical symbol for iron","Chemistry","Science"
"How many electrons are there in a neutral atom of copper","Chemistry","Science"
"What is the symbol for argon","Chemistry","Science"
"The atomic symbol for rutherfordium is Ru","Chemistry","Science"
"Every liquid is either a base or an acid","Chemistry","Science"
"It is a chemical change when water freezes","Chemistry","Science"
"Negatively-charged particles in the atom are called  electrons","Chemistry","Science"
"Approximately how many elements are in the Periodic Table of Elements","Chemistry","Science"
"Acids contain a ""H group"" and bases contain an ""OH group""","Chemistry","Science"
"The reactivity of an element is determined by valence electrons","Chemistry","Science"
"Solids have a crystal lattice because the particles","Chemistry","Science"
"Which group of elements most readily combines with Group 17 elements","Chemistry","Science"
"Plasma is comprised of atoms stripped of their electrons","Chemistry","Science"
"Which of the following best describes carbon monoxide","Chemistry","Science"
"Solutions, suspensions, and colloids are all types of mixtures","Chemistry","Science"
"Which example shows a coefficient being used correctly to balance a chemical equation","Chemistry","Science"
"Which statement about the Law of Conservation of Mass is NOT true","Chemistry","Science"
"How many valence electrons in a neutral oxygen atom","Chemistry","Science"
"How is a molecule different from an atom","Chemistry","Science"
"What is the element symbol for oxygen","Chemistry","Science"
"What is the element symbol for iron","Chemistry","Science"
"Why does an atom have no net electric charge","Chemistry","Science"
"Carbon is the most common element in the human body","Chemistry","Science"
"Isotopes are atoms of an element","Chemistry","Science"
"A solution of two or more metals such as brass is alloy","Chemistry","Science"
"What is the sum of every chemical reaction that occurs in the body","Chemistry","Science"
"Which subatomic particle has a positive charge","Chemistry","Science"
"Acids have a relatively high pH, compared to water","Chemistry","Science"
"In which family is an element in Group 16, Period 4 found","Chemistry","Science"
"A covalent bond typically forms between what kind of elements","Chemistry","Science"
"Which is a general term attributed to a large and complex molecule","Chemistry","Science"
"Acids usually have a pH value that is greater than 7","Chemistry","Science"
"Which represents a correct electron configuration for a chlorine atom","Chemistry","Science"
"Which of the following is a type of acid-base reaction","Chemistry","Science"
"Which form of matter has a definite volume and an indefinite shape","Chemistry","Science"
"What were the last two types of elements to be added to the Periodic Table","Chemistry","Science"
"What are two or more charged atoms held together by covalent bonds called","Chemistry","Science"
"Which property classifies cholesterol as a lipid","Chemistry","Science"
"What does a line in a Lewis structure represent","Chemistry","Science"
"Which of the following correctly names the precipitate formed in the reaction below","Chemistry","Science"
"What percent of carbon monoxide is oxygen","Chemistry","Science"
"What is the molarity of 138 g NaOH dissolved in 4000 mL of water","Chemistry","Science"
"Which of the following choices states the two main types of bonds","Chemistry","Science"
"Which macromolecule has a monomer known as a monosaccharide","Chemistry","Science"
"The First Law of Thermodynamics helps you to understand the","Chemistry","Science"
"What percent of aluminum chloride is aluminum","Chemistry","Science"
"A region of space in which an electron is most likely found is called an orbital","Chemistry","Science"
"Which particles' discovery was attributed to JJ Thomson","Chemistry","Science"
"Who said that everything in the universe is made up of tiny particles called atoms","Chemistry","Science"
"What process relates to the decomposition of food in the absence of oxygen","Chemistry","Science"
"Which of the following measures of mass has 3 significant figures","Chemistry","Science"
"Which hydrocarbon would be classified as saturated and an alkane","Chemistry","Science"
"The functional group that makes a carbon chain into a lipid is an amino group","Chemistry","Science"
"What kinds of elements are found in an ionic compound","Chemistry","Science"
"Which process takes light and changes it into chemical energy that is stored","Chemistry","Science"
"Which scientist devised the planetary model of the atom","Chemistry","Science"
"Elements in a group exhibit exactly the same behavior","Chemistry","Science"
"In a chemical equation, which symbol would you use to indicate that a substance dissolves in water","Chemistry","Science"
"Milk is an example of which state of matter","Chemistry","Science"
